id,text
1074772939797618694,"""E' non è mai alcuna cosa sì disperata, che non vi sia qualche via da poterne sperare""

Mandragola, atto I, scena I [55]
Niccolò Machiavelli"
1074770145661370368,RT @le_Parisien: Attentat de Strasbourg : «Bartek était l’exact opposé de celui qui l’a tué» https://t.co/jPAnUOaE8F
1074747722400522240,One would just need an army and an ideology. So easy! https://t.co/yjSKfIPt2Z
1074735001323929600,"RT @ncweaver: When the Bitcoin hash rate drops down to the red line, Bitcoin will be neither efficient NO secure as this will be the point…"
1074716130424578049,It's good to see people trying to build alternative institutions. @QuilletteM by @clairlemon is one such example. I hope @SamHarrisOrg succeeds! https://t.co/VqJifJkpz5
1074714380296699904,Hello Twitter! #myfirstTweet
