id,text
771520330322042880,"“Quando agimos, colhemos os frutos do nosso trabalho, mas, quando oramos, colhemos os frutos do trabalho de Deus.” 

(Hans Von Staden)"
744639938440925184,Dizer que cada um adora do seu jeito é uma falácia. Tem que ser do jeito certo. https://t.co/kxYjLZg1jZ
743530542264631296,"Deus não é obrigado a nos dar nada, mas pela sua misericórdia nos fez uma promessa que nunca estaríamos sozinhos. https://t.co/BNPUflAf5r"
735858326156742656,"É isto! ""Jamais espere receber de Deus, sem oração, o que Deus só promete conceder mediante a oração."" Sam Storms"
720790092206489600,"Missões, é preciso fazer. https://t.co/TWanQJKgco"
687809779050348546,"RT @marisa_lobo: Deus dá sinais, a gente que não entende.Olha a camiseta do dito cujo do LuLa..kkkk https://t.co/rvRQOftCWb"
614812834304774144,mas não nos deu o direito de mudar as coisas santas criadas por Ele como o casamento entre homem e mulher.
614812757112827904,"A todos que interessar. Deus nos deu o direito de sermos o que quisermos,"
