id,text
1037098630774059009,#アメリカから応援しています！#EndSexism
677958477080354816,How many times do I die today? \o/ | 1000 Follower Hype? xP https://t.co/B81bY83hef via @Twitch
671385425844523008,TEACH ME TO USE THE FORCE! #LegendaryYoda #CyberMonday #PhillyDDoItForMe https://t.co/1z4uNw3BRD
657629294185873408,I entered to win an @NvidiaGeForce-powered PC built by @Corsair &amp; @JahovasWitniss! https://t.co/w0U7L8x2Ic
626247187412848641,Win an Tek Syndicate case mod from V1 Tech and Red Harbinger https://t.co/nDjEkcKCzI
