id,text
1074814487608332288,"RT @SwisssTalk: У СССР было 1700 центров глушения западных радиостанций. Но это не помогло: сегодня нет ни CCCР, ни его глушилок. Ну ничему…"
1074814407736209409,"RT @SwisssTalk: Россия под управлением Путина 20 лет вставала с колен, но оказалась на карачках - отсталая и разворованная. Вариант прямохо…"
1074252169195474944,"RT @SwisssTalk: Ужасно раздражает, что твиты нельзя редактировать. Иногда просто чтобы исправить опечатку. Но ничего, говорит мне жена, ты…"
1074252137159372800,"RT @SwisssTalk: Будущее страны опять под вопросом: пока не известно, станет ли Путин директором цирка или начнёт карьеру рэпера. Как сообщи…"
1074181820625928192,RT @SwisssTalk: Случилось: у украинской Церкви свой предстоятель! Мои соболезнования Владимиру Михайловичу Гундяеву. Для украинцев он тепер…
1074181683849650177,"RT @SwisssTalk: Это сегодняшнее сообщение ТАСС (Телеграфного агенства Советского Союза). Кто-нибудь, сообщите им, что больше нет ни Советск…"
1073867454709940225,RT @SwisssTalk: После блокировки в Фейсбуке я в Твиттере как Ленин в Шушенском. Но боже мой - всего за неделю полторы тысячи новых подписчи…
