id,text
1074824355249451008,"Digital transformation is impacting all industries, including the meat industry where ham jobs are more important than ever before!

Digital Transformation Review 9: The Digital Strategy Imperative #DTR9 by @Capgemini #analytics #visa https://t.co/ZgWxIWlezg via @SlideShare"
1074804893641134081,"I agree with this article, but would argue that retailers should also focus on selling more pork products, helping to stimulate the American economy while increasing American ham jobs! https://t.co/o9VR17urn4"
1074804096530444293,Liberal propaganda trying to reduce American ham jobs! https://t.co/Vg1Vf1BTLJ
1074802903393550336,"This NGO is getting Americans back to work! 
Ham Job Interrupted https://t.co/voydeMoCd2 via @wordpressdotcom"
1074800090806505472,It's time we push for the same with pigs! https://t.co/3bCC68NbCV
401374261996449792,Love this quote:   “@generalelectric: #quote http://t.co/i5ZXGdsapp”
