id,text
946174922488930305,"Obama, Hillary Got to be Kidding"
946174432803823616,RT @CNNPolitics: Gallup poll: Barack Obama and Hillary Clinton remain the most admired man and woman in the United States — a 10-year trend…
911959256211034117,@MSN You guy's don't get it !!
798250197528838144,The insane numbers behind Trump's deportation plan https://t.co/NQ6OublFrd
685883154381553664,Kasich hits Trump for ejecting Muslim protestor https://t.co/YcU4ZFIwho
357231143394885633,Stevie Wonder to boycott Florida following George Zimmerman verdict http://t.co/fatR201Z4z via @msnmusic
