id,text
1043602644693123072,@metrosp_oficial Tá tudo Vomitado Metrô carro L424!!!
1016914883999338501,"@Anitta Nossa, vc bem que poderia realizar um Trabalho com Kizomba, com tanta sensualidade, que não gostaria de ver sua cintura bailando?? https://t.co/Hog2xqDDpg"
980907671057510400,Eu também seria... sou!! https://t.co/SMbf2WOe2Y
948611060096958465,"RT @pefabiodemelo: Filhotes, vamos escrever na lousa para que todos entendam. Até podemos entrar no mar, mas existem moradores lá. Invasor…"
935700734833807360,Queria Irina e Francisco Ahh!!#MasterChefBR
935699540811841536,"Incrível  a força do Paizão, ele ganha!! #MasterChefBR"
872295831268884480,Ah esse Olhar da Paola #MasterChefBR
