id,text
1049011861197414400,"@IngrahamAngle He still doesn't have a backbone.the press has neutered
All the bush rhinos."
1047591877233528832,Wouldn't it be great to find the media just half fair or better yet true.
1047152280192135168,"I'm a conservative,skin color or sex has nothing to do with character."
1047150884298403840,@seanhannity Fantastic.
1046123373380677633,She's safe she comes from that state that has alot of sheep. https://t.co/XuZLyinLuZ
1046122361488052225,Well I can understand you feeling that way after the left took what ever backbone you had. https://t.co/aj1O5zFAym
1043178976527769601,Pompeo does not need help from an idiot. https://t.co/W16BV4kHK9
1042560552629948416,I'm back on Twitter dah!
363711603557928960,"Sensing McConnell could be defeated, challengers try to unseat veteran Republican leader http://t.co/vqAqtJUlWQ"
248078276541681664,"@RepPaulRyan Mitt is not going to win on the talk show circuit it`s not natural,I dont want dinner w/mitt i want him to fix the country."
