id,text
1073045092183826433,@HdSymphonie https://t.co/waSegSTY1j
1071528909190123527,Bat pou se képi  w ki devan dèyè pa lespri w... @HdSymphonie
1041404518477561857,On y va sans pause! https://t.co/NGi7qjNQzb
1041400893583843333,@GarryGPPC Se sa ki rive lè se zam ki nan plas sèvo.
790747966571020288,Paradi tropical sur sound cloud le clip est pour bientôt HD Symphonie/ Powèt revolte
411882668456812544,What a year! http://t.co/9x9drFYiBj #SoLong2013
335158506049118209,Jounen lakay se pou 18 me map tann nou!
