id,text
1071022676079230976,Anthony Boyd Graphics | Isometric iPad Pro 2018 Mockup https://t.co/B29qHLJVRB
1061189852618809344,iMac &amp; Macbook Clay Mockups - PSD and Sketch Templates https://t.co/peOx7DG6Xr
1059208579343900672,Huawei Mate 20 Pro international giveaway @androidauth #giveaway https://t.co/8E6lXtAtp0
1039106594821341184,Anthony Boyd Graphics | Bezel-Less MacBook Pro with Touch Bar Mockup https://t.co/8r4C0DszwN
1039094341065687041,iPad Pro Mockups Free – https://t.co/zkpUm9jllU https://t.co/qziRM4D8V1 via @uxfreecom
1034880037319831552,Anthony Boyd Graphics | iMac Pro PSD Mockup https://t.co/OSLph7zXq7
970625482348814339,Anthony Boyd Graphics | Isometric iPhone X Mockup https://t.co/zcoIT062PK via @anthonyjboydii
970624789466570752,Anthony Boyd Graphics | Isometric iPhone X Mockup Vol.2 https://t.co/KjfAVb0Pfd via @anthonyjboydii
915211550335668224,iOS 8 Icon Template - https://t.co/p0rsBJV4XM #vector #psd #icon https://t.co/uTQCG6cc9o
852142184841269249,Ивелин Петков: Желанието за успех трябва да бъде по-силно от страха от провала https://t.co/mvvBFwv3Xv
