id,text
1075078985976086529,@FelipeCalderon Sabe muy bien que en el sureste se le paga a los lacandones y cuiden de la reserva y ellos mismos tumban árboles para sus siembra ¡les pagaban para destruir!  Al igual metieron un programa de la palma para el aseite y exportarlo al extranjero mucha gente tumbo todos sus árboles.
1074691488515284992,"RT @JTrianaT: @MAHP1804 @politico_gato @yimboroyimboro @SalvadorDelRi17 Pués nunca los vi hacer lo mismo el sexenio pasado, ahí les valía m…"
1074687367414472704,"@karlafedez @VicenteFoxQue @lopezobrador_ En zonas rurales solo dan paracetamol y naproxeno nunca hay medicamentos gente a muerto también por falta del recurso que bueno que a ti si te ayudaron fuiste afortunada, nada nos cuesta saber bien la propuesta y mejorar lo que tenemos"
1074686389160157184,"Se mira mal tanto ardor, recordemos sus años como presidente. Ganaba más. https://t.co/zC9ZWbwS0H"
1070314610304188416,"Esto es lo más horrible que puede pasar en nuestro país, como se puede gozar con el dolor de un animal inocente. https://t.co/vqvVwbN5IA"
