id,text
1074335638088908800,"Biased US intelligence would force a Jew/Zionist to commit a nonviolent crime and brand Zionists, but not Jews, who should not be part of the #criminaljusticereform all planned nicely, someone in the Pres.'s cabinent trying to oust @JaredKusher, as Kushner would have to picksides"
1074326854813724672,@MoonRainDiamond @GOP I meant you'd get in truble
1074207284111192065,"I had come up with the theory that US intelligence would force a Jew/Zionist to commit a nonviolent crime and brand Zionists, but not Jews, who should not be part of the  #CriminalJusticeReform point proven @AnnCoulter @IsraeliPM https://t.co/l3LLybrCko"
1074199543816761346,"https://t.co/bbLIaZEQ9B Watch as a Zionist somewhere out there in the US is forced to commit by the @CIA a hate or nonviolent crime and everyone condemns Zionists, but not Jews. US and Israeli relations would be strained. #CriminalJusticeReform @IsraeliPM @realDonaldTrump"
1073738941998653441,@CIA you are very bribed and politically biased!!!!
1073636770632224769,"@coasttocoastam US intelligence wants me to commit a crime like #amandaknox in order to screw up politics between the US and Israel. #JaredKushner works on the criminal justice reform, and if only I was a criminal like #AmandaKnox and made the news as a jewishrightwing extremist."
1073632454722744320,"@coasttocoastam Dr. Ford WAS molested, but in her sleep. She was given a drug so she couldn't move or wake up, and was sexually assaulted. This was done to defame kavanaugh. I know ghis classified i formation, because something similar has been happening to me."
1073617053431394304,"@DrBlasey You were sexually assaulted during your sleep, it was like a dream. This is why the memory came up out of no where, this is why you can't recall the place or day. You were given a drug so you could not move. This was all to defame Kavanaugh. A similar thing happenedtome"
1073612878140256256,@CIA is that all you got!? #tortured #sleep #sleeping #WheelOfFortune
1073610978263105536,"@coasttocoastam I have been getting tortured in my sleep, as a game between US and Israeli intelligence. The US wants me to commit a crime in oder to influence politics between Israel and the Jewish Diaspora. Since it would be on the news."
