id,text
1074798994277191680,Urge Congress and President Trump to Oppose Red Flag Gun Grabs https://t.co/v7pLURcH0U
1057430312022609920,Win The FN Five-seveN Pistol https://t.co/1DhU2skCH1
1057430170745950208,I just entered to win an FN Five-seveN #Pistol from @ClassicFirearm #gungiveaway #winagun @FN_America #dreamgun  #57x28mm #fiveseven #FNHUSA #guncontest Enter Here - https://t.co/XuwPR8Rmcy
1047636917381152768,Win A DRD Tactical  Paratus Gen-2  .308 Rifle https://t.co/YI6DZ6WvCL
1047636807658196993,I just entered to win a DRD Tactical Paratus 2  @ClassicFirearm #gungiveaway #winagun #paratus2 #DRDTactical #GEISSELE #USMADE #dreamgun #riflegiveaway #billet #guncontest Enter Here - https://t.co/YI6DZ6WvCL
1047635162668969984,"@ClassicFirearm Great Products, Prices and Fast Shipping."
