id,text
1075104832183164929,Knowledge  and incompetence the trump administration has when it comes Foreign policy and the rule of law @realDonaldTrump refuses to follow the rule of law especially if go against his political and personal agenda https://t.co/NA9jngccrI
1075104812499316736,"They endanger the safety of people in the united states but that is only because od the fear mongering and hate speach made by @realDonaldTrump @ICEgov @DHSgov @CBP @HHSGov @jeffsessions @GOP @UNGeneva
And that is a shame and a crime against humanity and children
And a lack of"
1075104811102625794,"From persecution by the countries
They seek asylum or refugee status in  based on violence and war torn countries  they come from
Look at what @realDonaldTrump is doing he is refusing entry to anyone who needs asylum
Yes the immigration laws in the united states is very weak and"
1075104809097678851,Until you do that this campaign will not happen and and country's like the united states with continue to torture and abuse migrant children and thee families and unlawful detain them in inhumane prisons and in prisons for profit  the people of the world deserve to be free
1075104806631436288,"@@UN @Refugees @NILC_org @UN_PGA

But first you need to take a more
Active role and make it a crime against humanity and children for any country or government under the united Nations general Assembly that refused or ban migrants and or refugees from entering there countries https://t.co/S1yzQ2rpJ9"
1075099134204436481,I agree and any country there does not comply should face severe international circumstances by @IntlCrimCourt like sanctions and possible prosecution https://t.co/GOM8sq4vnv
1074819898994388992,"Truth hurts liers more the public shaming doesn't @realDonaldTrump 
https://t.co/QYKrxlvN64"
1074819587059855360,"Trump lies we know that it is only time when all his lies get him put in prison for the rest of his life
For treason child abuse and neglect
The death of a 7 year old migrant child while in his government's custody 
https://t.co/D3YL8H3KIz"
1074818472318619648,"The trump family deserves to be in prison on treason and child abuse and torture of migrant children and there families and for corporate fraud and money laundering
They are al criminals and should be treated as such 
https://t.co/5hR8pNpMb6"
1074817863226089473,"My thoughts exactly @realDonaldTrump 
https://t.co/01juVrLi5l"
