id,text
1075027913479602176,"RT @SemangatPositif: Petik pelajaran terbaik dari hari kemarin, jalani dan nikmati hari ini, dan bangun harapan baik untuk esok hari."
1075027593508737025,RT @SemangatPositif: Ikhlas menerima kekurangan adalah awal dari kelebihan manusia.
1074867353031081984,"RT @BerpikirCinta: Meski kau pernah terluka, jangan alergi untuk kembali jatuh cinta. Sakit hati hanya bisa diobati oleh jatuh hati."
1074867045127282688,"RT @BerpikirCinta: Saat kau sibuk mencari pasangan yang sempurna, kau akan kehilangan cinta yang terbaik."
1074866497636290560,RT @BerpikirCinta: Jangan terlalu berharap. Jangan marah-marah. Tidak perlu berasumsi. Jangan banyak pertanyaan. Jangan pernah menuntut. Bi…
