id,text
747483002670878720,"I just got a score of 1129 in the pirates level of NinJump Deluxe Free, a FREE game from Backflip Studios! https://t.co/Ap3Tk5viYN"
645050912134836228,http://t.co/JJ7h51tsna
593060624705441793,RT @BBCAfrica: An audit of Nigeria's state oil company has found it overpaid the government by about three-quarters of a billion dollars.
446170073871704064,"RT @9Joe9: @W7VOA No, this one is better http://t.co/AtY0IAiInu"
236917986752090112,All the Hemispheres (Hafez) http://t.co/N1rsfmnL via @sharethis
