id,text
1075090115792396294,"Qué triste que te de miedo subir una foto conmigo. 
Tranquilo, si no te pelaron cuando no tenías novia, menos te van a hacer caso ahora."
1074890476594049026,RT @BarraganMeli_: como duele ser tan buena y que se lo pasen por el orto
1074889969024552961,"Podría estar conquistando el mundo, pero tengo un bebé de casi 30 años en casa que no me deja crecer en paz."
1074857568034537472,"@jesus58206564 No, pero como ayuda ;)"
1074809948385759232,Todo el mundo necesita una identidad secreta.
1074808815625912320,"Pensé que hoy te iba a ver sudar, pero encima de mi, no en un partido de soccer."
