id,text
1073601937600364544,"Psalm 91 Scripture Song ""My God, In Him I Will Trust"" (Esther Mui) https://t.co/PkHxwU5oiQ ข้อมูลจาก @YouTube"
1004029308757610496,คําปราศรัยในการประชุมเพื่อเตรียมการจัดตั้งพรรคอนาคตใหม่ - ธนาธร จึงรุ่งเรืองกิจ https://t.co/QzVJo88Hrz
500151195059499008,"Check out Viber, it's an app that lets you make free calls from your iPhone http://t.co/FAxz4BmarG via @Viber"
491429956849639424,"LOVE is..Charity suffereth long, and is kind; charity envieth not; charity vaunteth not itself, is not puffed up, http://t.co/cWWYIw7YCC"
461726853762281472,@RickWarren
