id,text
1075054062716907520,"@TheGamingLemon That ""mustache"" is lookin' fresh as hell Brad👌"
1075053837222797313,We are all bad someone's story.
1075053722625921024,"RT @ABSCBNNews: Sam Milby, nag-sorry para sa karakter niya sa 'Halik' https://t.co/WbLihJMRdF"
1074845175665442816,"Dang, ain't that a fine background, ladies and gentlemen? https://t.co/eBoZj4Cf52"
1074836744208437248,"Have you ever had that feeling, that you really like someone. But then it turns out, the person you like is in love with someone?"
